{
  "schema_version": "0.1",
  "id": "fact-auth-predicted",
  "key": "authentication.boundary_modified",
  "value": false,
  "stage": "predicted",
  "confidence": "medium",
  "subject": {
    "repository": "acme/payments",
    "revision": "rev-a"
  },
  "provenance": {
    "type": "intent_analysis",
    "producer": "impact-classifier-v1"
  }
}
