{
  "schema_version": "0.1",
  "id": "fact-auth-1",
  "key": "authentication.boundary_modified",
  "value": false,
  "stage": "observed",
  "confidence": "high",
  "subject": {
    "repository": "acme/payments",
    "revision": "rev-a"
  },
  "provenance": {
    "type": "path_analysis",
    "producer": "boundary-detector-v1"
  }
}
